{
  "prospect": { "name": "Acme Rockets", "short": "Acme", "domain": "acmerockets.com" },
  "title": "Acme: Rise of the Rockets",
  "tagline": "Made for Acme Rockets by PostHog",
  "palette": { "primary": "#e0402a", "secondary": "#1c2a4a", "accent": "#f7c948" },
  "products": ["feature_flags", "session_replay", "error_tracking", "experiments", "product_analytics", "data_warehouse"],
  "music": { "mood": "calm, determined, space-age, mission control", "bpm": 108 },
  "text": {
    "win": "Every launch site is yours and every satellite reached orbit. Mission control is cheering.",
    "lose": "The launch was scrubbed. Check the telemetry, refuel, and plan a new flight.",
    "credits": "Made for the Acme Rockets crew by PostHog"
  },
  "game": {
    "difficulty": "hard",
    "biome": "desert",
    "faction": { "name": "Acme Rockets", "capital": "Mission HQ" },
    "cities": ["Pad 39A", "Telemetry Hill", "Orbit Station", "Fuel Depot", "Launch Ridge"],
    "rival": {
      "name": "The Scrub Monster",
      "capital": "Scrub Bunker",
      "taunts": ["T-minus never. This launch is scrubbed.", "Another pad under my hold. Weather is bad forever.", "You broke my countdown!", "Tick tock. Your window is closing."],
      "defeat": "All systems go. The Scrub Monster drifts off into deep space.",
      "sprite_prompt": "a grumpy grey storm cloud monster with lightning eyebrows and a red abort button nose"
    },
    "tips": [
      "Take Pad 39A early: launch sites pay out stars every turn.",
      "Feature Flags let you shield your cities. Launch to 1% before 100%.",
      "Harvest near Mission HQ to level it up before the Scrub Monster arrives.",
      "Forests hide your crew. Fight from cover, like a good release plan."
    ],
    "tech_lines": {
      "feature_flags": "Roll out to 1% of satellites first",
      "error_tracking": "Catch it before the customer calls",
      "session_replay": "Replay the telemetry UI, frame by frame",
      "data_warehouse": "Join telemetry with billing in SQL"
    },
    "units": { "scout": "Cadet", "warrior": "Engineer", "archer": "Telemetrist", "defender": "Flight Guard", "catcher": "Bug Hunter" },
    "hq_prompt": "a tall white rocket assembly building with a red and navy rocket standing beside it"
  }
}
